{
  "id": "fig-cdisc-001",
  "type": "figure_record",
  "title": "Source figure evidence",
  "version": "1.0.0",
  "schema_version": "1.0.0",
  "content_status": "verified",
  "approval_status": "approved",
  "domains": ["SDTM"],
  "workflow_stages": ["sdtm_spec"],
  "topics": ["visual evidence"],
  "aliases": [],
  "authority": "industry_standard",
  "applicability": {"therapeutic_areas": [], "trial_phases": [], "sponsor_ids": [], "study_ids": [], "conditions": []},
  "sources": ["src-cdisc-001"],
  "owner": "knowledge-curation",
  "created": "2026-07-13T00:00:00Z",
  "last_reviewed": "2026-07-13",
  "review_due": "2099-12-31",
  "supersedes": [],
  "superseded_by": null,
  "content_hash": "eeeeeeeeeeeeeeeeeeeeeeeeeeeeeeeeeeeeeeeeeeeeeeeeeeeeeeeeeeeeeeee",
  "rights_status": "cleared",
  "allowed_uses": ["runtime"],
  "storage_mode": "local_only",
  "contract_compatibility": {"minimum": "1.0.0", "maximum_exclusive": "2.0.0"},
  "approval_receipt_id": "receipt-004",
  "audit_reference": "audit/receipt-004.json",
  "source_id": "src-cdisc-001",
  "source_sha256": "aaaaaaaaaaaaaaaaaaaaaaaaaaaaaaaaaaaaaaaaaaaaaaaaaaaaaaaaaaaaaaaa",
  "figure_sha256": "eeeeeeeeeeeeeeeeeeeeeeeeeeeeeeeeeeeeeeeeeeeeeeeeeeeeeeeeeeeeeeee",
  "locator": {"physical_page": 4, "printed_page": "2", "bbox": [10.0, 20.0, 100.0, 140.0]},
  "caption": "Controlled example figure.",
  "derivation": {
    "derivation_id": "derive-figure-001",
    "tool": "page-cropper",
    "tool_version": "1.0.0",
    "input_sha256": "aaaaaaaaaaaaaaaaaaaaaaaaaaaaaaaaaaaaaaaaaaaaaaaaaaaaaaaaaaaaaaaa",
    "output_sha256": "eeeeeeeeeeeeeeeeeeeeeeeeeeeeeeeeeeeeeeeeeeeeeeeeeeeeeeeeeeeeeeee",
    "parameters_sha256": "ffffffffffffffffffffffffffffffffffffffffffffffffffffffffffffffff",
    "created_at": "2026-07-13T00:00:00Z"
  }
}
